title,desc,host,availability,star,price
Stanza a Atlanta,Soggiorna con Destiny,Downtown Beach Room * POSTO AUTO GRATUITO * Camera privata,01–06 ott,"4,85 (659)",67 € 
Appartamento ⋅ Atlanta,Petite Virginia Highland Studio!,Host professionista,01–06 ott,"3,5 (4)",71 € 
Appartamento ⋅ Atlanta,Parcheggio gratuito! A pochi minuti dal centro di Atlanta,Host professionista,01–06 ott,"4,78 (136)",166 € 
Appartamento ⋅ Atlanta,Midtown Atlanta Apartment,Host professionista,01–06 ott,Nuovo,84 € 
Stanza a Atlanta,Soggiorna con Kadeem,ATL Saturn Suite :)w/ Office+NO CLEAN FEE,01–06 ott,"4,6 (15)",62 € 
Stanza a Atlanta,Soggiorna con Sydnee,Bella camera da letto matrimoniale con TV e wifi,01–06 ott,"4,5 (22)",63 € 
Alloggio (Atlanta),Camera da letto nel cuore della città con cucina completa (J),Host professionista,06–11 ott,"4,58 (60)",78 € 
Stanza a Atlanta,Soggiorna con Shandlyra,Spazio minimalista ad Atlanta,06–11 ott,"5,0 (3)",45 € 
Alloggio (Atlanta),"Vicino al centro di Atlanta, lussuoso e tranquillo",1 letto matrimoniale,01–06 ott,"4,92 (38)",80 € 
Stanza a Atlanta,Soggiorna con Averil And April,Bella camera appena ristrutturata! Lavatrice/asciugatrice incluse,03–08 ott,"4,84 (98)",70 € 
Stanza a Atlanta,Soggiorna con Adrianne,Travelers Rest: Historic Westend,16–21 ott,"4,85 (112)",60 € 
Stanza a Atlanta,Soggiorna con Roger And Maria,Room2@Love n Life Travel Pad,18–23 ott,"4,9 (535)",64 € 
Stanza a Atlanta,Soggiorna con Adrianne,Viaggiatori riposano 2: Historic Westend,15–20 ott,"4,71 (96)",61 € 
Appartamento ⋅ Atlanta,Grazioso monolocale in Virginia Highlands,Host professionista,01–06 ott,"3,69 (13)",78 € 
Alloggio (Atlanta),Camera privata con letto matrimoniale sulla Beltline.,1 letto matrimoniale,01–06 ott,"4,46 (13)",75 € 
Stanza a East Point,Soggiorna con Kelechi,Business/Student Travelers Room,21–26 ott,"4,69 (35)",53 € 
Suite degli ospiti ⋅ Atlanta,Studio del cuore della città,Host professionista,01–06 ott,"4,88 (16)",108 € 
Suite degli ospiti ⋅ Atlanta,ATL OASIS: No Pet Fee/ Near Downtown & Airport,3 letti,01–06 ott,"4,9 (155)",143 € 
Stanza a Atlanta,Soggiorna con Pearlie,Accogliente e tranquillo con un tocco di eleganza,01–06 ott,"4,95 (99)",75 € 
Stanza a Smyrna,Soggiorna con Jordan,Perfect Getaway Bedroom 2,02–07 ott,"5,0 (25)",60 € 
Minicase ⋅ Atlanta,Tiny House Urban Farm Stay nel cuore di Atlanta,Host privato,15–20 ott,"4,89 (537)",134 € 
Stanza a Atlanta,Soggiorna con Destiny,Downtown Beach Room PARCHEGGIO GRATUITO Bagno privato,01–06 ott,"4,81 (746)",78 € 
Stanza a Atlanta,Soggiorna con SD Homes,Cuore della camera della città con bagno(B),01–06 ott,"5,0 (5)",74 € 
Appartamento ⋅ Atlanta,Eccellente appartamento Virginia Highland!,Host professionista,01–06 ott,"4,3 (239)",78 € 
Stanza a Atlanta,Soggiorna con Amir Travels,Ridente casa moderna con una camera da letto e parcheggio gratuito,01–06 ott,"4,54 (26)",51 € 
Stanza a Marietta,Soggiorna con Elvira,Stanza tranquilla 2,01–06 ott,"4,73 (22)",56 € 
Stanza a Atlanta,Soggiorna con Isaac,Relaxing room near the Airport,03–08 ott,"4,68 (22)",66 € 
Stanza a Atlanta,Soggiorna con Rick,"O6 Stanza piccola e confortevole, vicino GT",05–10 ott,"4,17 (72)",47 € 
Stanza a Atlanta,Soggiorna con Kadeem,La tua seconda casa ATL:)|w/ Office+NO XTRA FEE,01–06 ott,Nuovo,64 € 
Stanza a Decatur,Soggiorna con Jonathan,Crash-Pad appartato Conveniente ai siti di Atlanta,02–07 ott,"4,84 (202)",70 € 
Stanza a Atlanta,Soggiorna con Michael,"Economico, pulito, atmosfera tranquilla a Summerhill, ATL",01–06 ott,"4,56 (18)",63 € 
Stanza a Atlanta,Soggiorna con Christopher,Camera privata + Scrivania + TV,01–06 ott,"4,82 (11)",73 € 
Stanza a Atlanta,Soggiorna con Mirella Property Management,Camera rosa privata situata a 3 miglia dal centro!,01–06 ott,"4,89 (9)",48 € 
Stanza a Ellenwood,Soggiorna con Cherish,Prospering (17 mins from ATL Airport),01–07 ott,Nuovo,53 € 
Alloggio (Atlanta),Butterfly Motel 4 no couples,Host privato,03–10 ott,"4,43 (7)",47 € 
Stanza a Atlanta,Soggiorna con Noreen,Modern room in shared guesthouse near airport,01–06 ott,"5,0 (7)",57 € 
Stanza a Conley,Soggiorna con Kadeem,Ocean Suite of ATL <3| Materasso in memory foam + TT,02–07 ott,"4,38 (16)",53 € 
Appartamento ⋅ College Park,❤ King Lodges Ste-A comfortable king Netflix/Disney/Amzn,1 letto,01–06 ott,"4,46 (125)",89 € 
Stanza a Atlanta,Soggiorna con Peter,Stanza dello specchio,02–08 ott,"4,64 (302)",55 € 
Stanza a Atlanta,Soggiorna con Nde,Private Room - 10 mins from DT,02–07 ott,Nuovo,63 € 
Stanza a Lawrenceville,Soggiorna con Alicia,Cheerful Twin Daybed + Trundle #4 (semi-privato),03–08 ott,"5,0 (17)",43 € 
Stanza a East Point,Soggiorna con Elle,"Sig.ra Elle. Accogliente casa aeroportuale, camera accessoria",06–11 ott,"4,66 (77)",52 € 
Stanza a East Point,Soggiorna con Lewis,"Serena, Quaint, confortevole ed elegante casa a schiera2",03–08 ott,"5,0 (6)",51 € 
Minicase ⋅ Atlanta,Metro Countryside,2 letti,07–12 nov,Nuovo,81 € 
Stanza a Marietta,Soggiorna con Elvira,Sala Tranquilla,01–06 ott,"4,9 (29)",56 € 
Stanza a Atlanta,Soggiorna con Anderson,Fuga privata - Affitto a breve/lungo termine,02–07 ott,"4,81 (47)",72 € 
Stanza a Atlanta,Soggiorna con Fang Yuan Properties,New Bedroom Private Bath(CA),01–06 ott,Nuovo,68 € 
Stanza a Atlanta,Soggiorna con Dame Good,Dame Good room 4,01–06 ott,"4,67 (6)",60 € 
Alloggio (Atlanta),Heart Of City Close 2 All -Marta,1 letto,01–06 ott,no rating,56 € 
Stanza a Atlanta,Soggiorna con Ike,Home Away 5,01–06 ott,"4,33 (3)",47 € 
Stanza a Atlanta,Soggiorna con Scott,"Master Suite, passeggiata fino a Emory 1/2 mi",22–27 ott,"4,83 (269)",93 € 
Stanza a Atlanta,Soggiorna con Akua,Stanza da letto elegante nel cuore del centro di Atl,08–13 ott,"4,79 (62)",62 € 
Stanza a Lilburn,Soggiorna con Phil,Camera da letto minimalista,02–07 ott,"4,58 (12)",53 € 
Appartamento ⋅ Sandy Springs,Luxxe Apt. con piscina. WiFi. Parkn.,Host privato,01–06 ott,"5,0 (5)",161 € 
Appartamento ⋅ Atlanta,"Appartamento in una fattoria di fiori con polli, vicino a tutto",Host privato,08–13 ott,"4,77 (408)",109 € 
Alloggio (Atlanta),Stanza zen privata situata a 3 miglia dal centro!,1 letto,01–06 ott,"4,5 (8)",37 € 
Alloggio (Atlanta),Soggiorna con William,"Senza costi nascosti, raggiungi a piedi tutto ciò di cui hai bisogno.",14–19 ott,"4,78 (73)",91 € 
Casa ⋅ Atlanta,Unique 2BR Less than a mile from the Atlanta Zoo!,Host professionista,01–06 ott,"4,25 (8)",121 € 
Alloggio (Atlanta),Parcheggio gratuito nel cuore della città nella nuova camera da letto (T),Host professionista,02–07 ott,"4,57 (68)",73 € 
Alloggio (Atlanta),Soggiorna con Olson,Camera #9 QUESTA È una CASA CONDIVISA/BAGNO Cozy Room,13–18 nov,"4,85 (382)",60 € 
Alloggio (Atlanta),Soggiorna con Jamual,Comodo e ordinato (vicino all'aeroporto e agli ospedali),29 ott – 03 nov,"4,88 (375)",61 € 
Campeggio ⋅ Atlanta,Micro-Cabin/Crash Pad nella minicasa,Host privato,04–09 nov,"4,93 (110)",45 € 
Alloggio (Atlanta),Soggiorna con Anderson,Chill Pad Deluxe - Noleggio camere a breve/lungo termine,01–06 ott,"4,76 (58)",73 € 
Alloggio (Atlanta),Soggiorna con Emmanuel,Tranquility Room nel centro di Atlanta,08–13 ott,"5,0 (3)",70 € 
Alloggio (Atlanta),Soggiorna con Sainthia,Camera privata in casa condivisa n.2,01–06 ott,Nuovo,71 € 
Appartamento ⋅ Atlanta,Quit peaceful one bedroom apt,Host professionista,08–13 ott,Nuovo,74 € 
Alloggio (Atlanta),Soggiorna con Noreen,READ ALL: Private room for daytime layover,01–06 ott,Nuovo,55 € 
Suite degli ospiti ⋅ Decatur,Suite per gli ospiti completa vicino a Emory | CDC | Piazza Decatur,Host privato,01–06 ott,"4,79 (243)",114 € 
Alloggio (Doraville),Soggiorna con Topher,Crash pad + stazione remota + TV,02–09 ott,"4,93 (14)",54 € 
Alloggio (Decatur),Soggiorna con Aubrey,Cheerful 1 Bedroom by Golfcourse East Atlanta BR03,01–06 ott,"4,89 (9)",62 € 
Alloggio (Atlanta),Soggiorna con Akua,Camera da letto elegante nel cuore del centro di Atlanta,08–13 gen,"4,88 (50)",60 € 
Alloggio (Atlanta),Bella camera da letto vicino al centro di Atlanta (New York),Host professionista,01–06 ott,"4,8 (61)",64 € 
Stanza a Atlanta,Soggiorna con Danielle,Camera privata: 1 miglio dal Mercedes-Benz Stadium,06–11 ott,"4,62 (160)",68 € 
Stanza a Atlanta,Soggiorna con Rob,Oasis in Historic Adair Park,01–06 ott,"5,0 (9)",70 € 
Appartamento ⋅ Atlanta,*New*LUXURY* Atl *APT* highrise!,1 letto matrimoniale grande,01–06 ott,Nuovo,247 € 
Appartamento ⋅ Atlanta,Intero appartamento ATL: a 10 MINUTI da tutto!,1 letto,30 ott – 04 nov,"4,89 (9)",110 € 
Stanza a Clarkston,Soggiorna con Karyn,Incantevole 1 camera/Buenos Aires privata in una casa a schiera condivisa,18–25 ott,"4,8 (10)",42 € 
Appartamento ⋅ Atlanta,Una camera King all'Even Atlanta Hotel,1 letto matrimoniale grande,04–09 ott,"4,83 (139)",204 € 
Bed and breakfast ⋅ Atlanta,Private Rm 10 min Braves Stadium,1 letto,01–06 ott,Nuovo,79 € 
Alloggio (Atlanta),Camera di lusso vicino al centro di Atlanta,1 letto matrimoniale,02–07 ott,"4,77 (31)",81 € 
Stanza a Atlanta,Soggiorna con Arthur,Letto privato e bagno nello Historic Grant Park,15–20 ott,"4,94 (202)",86 € 
Stanza a Atlanta,Soggiorna con Averil And April,Camera recentemente ristrutturata! Uso lavatrice/asciugatrice incluso,08–13 ott,"4,85 (118)",54 € 
Stanza a Smyrna,Soggiorna con Jordan,Perfect Getaway Bedroom 1,04–09 nov,"5,0 (29)",54 € 
Stanza a Atlanta,Soggiorna con Jake,Camera completamente arredata nel Semmes Park,01–06 ott,"5,0 (3)",69 € 
Stanza a Atlanta,Soggiorna con Emmanuel,Calm Room in Central Atlanta,04–09 ott,Nuovo,57 € 
Stanza a Atlanta,Soggiorna con Sam,Crew St,15–20 ott,"4,86 (7)",90 € 
Alloggio (Atlanta),Camera di lusso in una casa da milioni didollari in centro (Garnet),2 letti,02–07 ott,"4,68 (44)",74 € 
Appartamento ⋅ Atlanta,"Bold, Bright, Beautiful | * Da 1 a 24 ospiti *",Host privato,21–26 ott,"4,93 (1351)",138 € 
Pensione ⋅ Atlanta,Atlanta Pools and Palms Paradise,3 letti,08–13 ott,"5,0 (36)",266 € 
Stanza a Atlanta,Soggiorna con Caleb,Stanza storica + bagno nel Darling Cottage con gatti,16–21 nov,"4,95 (43)",71 € 
Alloggio (Atlanta),F2 Bagno privato in camera di lusso,1 letto,04–09 ott,"5,0 (9)",88 € 
Stanza a Atlanta,Soggiorna con Destiny,Downtown Beach Room ** POSTO AUTO GRATUITO ** Camera privata,08–13 ott,"4,84 (492)",67 € 
Appartamento ⋅ Atlanta,Elegante Midtown Studio,Host professionista,04–09 ott,Nuovo,146 € 
Appartamento ⋅ Atlanta,Servizi moderni e lussuosi dell'oasi di lusso (5*),1 letto matrimoniale grande,01–06 ott,"4,92 (38)",195 € 
Alloggio (Atlanta),Lussuosa camera da letto in una casa finita di fascia alta (Ru),1 letto matrimoniale,12–17 ott,"4,75 (36)",88 € 
Stanza a Atlanta,Soggiorna con Bryan,Camera privata in stile hotel e bagno privato,26 nov – 01 dic,"4,86 (248)",74 € 
Suite degli ospiti ⋅ Atlanta,Month+ Ready: Modern Nook,2 letti,12–19 ott,Nuovo,137 € 
Suite degli ospiti ⋅ Snellville,Vicino a Stone Mountain - Studio in stile hotel,Host privato,01–06 ott,"4,95 (171)",92 € 
Stanza a Atlanta,Soggiorna con Kadeem,Suite Royal Flush a 5 stelle ~ Camera privata,07–12 ott,"4,63 (86)",57 € 
Alloggio (Atlanta),Lisa Land 689 Camera da letto 3,Host professionista,01–06 ott,"4,44 (18)",66 € 
Stanza a Decatur,Soggiorna con Sahar,Accogliente bed and breakfast privato!,01–06 ott,"5,0 (26)",83 € 
Appartamento ⋅ Atlanta,"Vivace, Superior 1Bed Downtown ATL",1 letto matrimoniale,22–27 ott,"4,69 (189)",143 € 
Appartamento ⋅ Atlanta,Nuovo annuncio! Casa del centro città di lusso,Host professionista,08–13 ott,Nuovo,187 € 
Stanza a Atlanta,Soggiorna con Sydnee,Tranquilla camera da letto matrimoniale,01–06 ott,"3,91 (11)",55 € 
Appartamento ⋅ Atlanta,The Emerson Near PonceCityMarket,Host privato,01–06 ott,"4,9 (20)",152 € 
Stanza a Atlanta,Soggiorna con Stuart,#5 Camera mansardata con aria condizionata e TV,04–09 ott,"4,42 (43)",40 € 
Alloggio (Atlanta),Bellissimo maestro con bagno privato (camera Miami),Host professionista,01–06 ott,"4,62 (63)",68 € 
Stanza a Smyrna,Soggiorna con Clark And Virginia,Posizione del Grande Slam | Camera da letto privata,07–12 ott,"4,95 (355)",86 € 
Stanza a Atlanta,Soggiorna con David,"Camera accogliente e confortevole, di Ga Tech, Mercedes Benz Stadium",05–10 nov,"4,67 (604)",75 € 
Suite degli ospiti ⋅ Atlanta,Rilassati in una suite moderna nell'East Atlanta Village,Host privato,01–06 ott,"4,77 (110)",119 € 
Stanza a Atlanta,Soggiorna con Rierre,The Chateau,01–06 ott,"4,9 (250)",82 € 
Alloggio (Atlanta),Modern Farmhouse in Atlanta!,2 letti,01–06 ott,Nuovo,118 € 
Stanza a College Park,Soggiorna con Sebastian,Monolocale privato,03–08 ott,"4,75 (4)",36 € 
Stanza a Riverdale,Soggiorna con Rosetta,Tranquillo 1 Camera per Adulti,10–15 ott,"4,87 (67)",45 € 
Alloggio (Decatur),Comfort semplice; Camera privata,1 letto,10–15 ott,"4,53 (15)",44 € 
Stanza a Atlanta,Soggiorna con Doug,ATL MARTA BUS FRIENDLY SPAZIO CONVERTITO,01–06 ott,"4,6 (57)",44 € 
Appartamento ⋅ Atlanta,Luxe in The City-ATL con balcone,1 letto matrimoniale,01–06 ott,"4,78 (36)",194 € 
Appartamento ⋅ Atlanta,Midtown Apartment 3 Bedroom,Host professionista,01–06 ott,Nuovo,127 € 
Stanza a Atlanta,Soggiorna con Olson,Camera #10 SHARE HOUSE/BATHROOM Private Cozy Room.,02–07 ott,"4,81 (341)",64 € 
Cupola ⋅ Stonecrest,Forest Dome with Hanging Bed on the Farm,Host privato,29 ott – 03 nov,"4,75 (163)",131 € 
Stanza a Atlanta,Soggiorna con Moza,Conveniente Downtown Atlanta Bedroom,01–06 ott,"4,72 (134)",57 € 
Appartamento ⋅ Atlanta,Luxury Buckhead Living,Host privato,22–27 ott,"5,0 (9)",151 € 
Appartamento ⋅ Atlanta,Luxury Atlanta Loft with City View,1 letto,01–06 ott,"4,82 (33)",174 € 
Casa sull'albero ⋅ College Park,Fantastica casa sull'albero appartata: appannamento!,1 letto,01–06 ott,"4,88 (8)",126 € 
Stanza a Atlanta,Soggiorna con Ty & Nadia,The Gallery House near the Stadium,09–14 ott,"4,85 (612)",92 € 
Stanza a Atlanta,Soggiorna con Brandi,Bellezza e storia,01–06 ott,Nuovo,74 € 
Stanza a Atlanta,Soggiorna con Lizzy,Queen Bed & Desk w/ Monitor Minutes From Airport!,10–15 ott,"5,0 (5)",52 € 
Stanza a Atlanta,Soggiorna con Terhas,Urban Oasis,01–06 ott,"4,9 (240)",104 € 
Stanza a Atlanta,Soggiorna con Stuart,"#6 Camera mansardata con 2 LETTI singoli, TV e aria condizionata",16–21 ott,"4,59 (44)",47 € 
Casa sull'albero ⋅ Atlanta,Archimedes ’Nest at the Emu Ranch,Host privato,08–13 ott,"4,98 (529)",455 € 
Stanza a Atlanta,Soggiorna con Kadeem,La tua Lanta Suite a 5 stelle x Ufficio,03–08 ott,"4,83 (6)",68 € 
Appartamento ⋅ Atlanta,✨ Benvenuto AL PLAYBOY LOUNGE condominio IN ATL,2 letti,08–13 ott,"4,78 (225)",180 € 
Stanza a Atlanta,Soggiorna con Rutu,Camera privata con ingresso separato e bagno,08–13 ott,"4,91 (22)",71 € 
Stanza a Atlanta,Soggiorna con Justin,Pittoresco riposo contro la foresta,04–09 ott,"4,68 (47)",71 € 
Stanza a East Point,Soggiorna con Adeyinka,Vita moderna di metà secolo,07–12 ott,"4,94 (18)",68 € 
Stanza a Atlanta,Soggiorna con Olson,#8 Ampia camera da letto matrimoniale con bagno privato,22–27 ott,"4,85 (301)",75 € 
Stanza a Atlanta,Soggiorna con Monaco,Spazioso 1 letto e bagno privato,06–11 ott,"4,72 (417)",62 € 
Appartamento ⋅ Atlanta,Downtown Suite,1 letto,29 ott – 03 nov,Nuovo,147 € 
Pensione ⋅ Atlanta,4A Camera da letto privata 1B/1B a 10 minuti dall'aeroporto ATLA,Host privato,09–14 ott,"4,92 (51)",82 € 
Stanza a Atlanta,Soggiorna con Kadeem,ATL Peace Suite <3| w/ Office + No XTRA Fee,05–10 ott,Nuovo,65 € 
Casa ⋅ Atlanta,Affluent Downtown Rooftop Cityscape,Host professionista,19–24 ott,"4,85 (27)",331 € 
Appartamento ⋅ Atlanta,Monolocale con un letto matrimoniale e divano letto al Residence Inn,Host privato,20–25 ott,"4,59 (22)",253 € 
Appartamento ⋅ Atlanta,Casa verde! Fuga in centro,1 letto,30 ott – 04 nov,"4,7 (50)",119 € 
Appartamento ⋅ Decatur,"Medlock North, vicino ad Agnes Scott, Emory e CDC",Host professionista,01–06 ott,"4,94 (141)",119 € 
Casa ⋅ Atlanta,Zoo Atlanta Atlanta,5 letti,02–07 ott,Nuovo,227 € 
Alloggio (Lilburn),Unic Bedroom privacy WI-FI Vicino ai negozi,Host professionista,01–06 ott,"4,95 (19)",51 € 
Stanza a Atlanta,Soggiorna con Jay,Lounge storica - BR privata nel cuore di ATL#2,07–12 ott,"4,85 (297)",92 € 
Stanza a Atlanta,Soggiorna con Kadeem,ATL Mango Suite :)~w/ Office Space|NO CLEAN FEE,08–13 ott,"4,81 (16)",60 € 
Casa ⋅ Atlanta,Bella casa 2Br in ATL con parcheggio e wifi gratuiti,Host professionista,01–06 ott,"4,75 (4)",138 € 
Appartamento ⋅ Atlanta,Crash Pad Downtown ATL,1 letto,08–13 ott,"4,29 (14)",122 € 
Stanza a Atlanta,Soggiorna con Shawn,"Gamer Retreat! Oltre 100 videogiochi, snack e patio",01–06 ott,"5,0 (8)",81 € 
Stanza a Lithonia,Soggiorna con Amber,My Suite Garage-CitySky,02–07 ott,Nuovo,56 € 
Pensione ⋅ Atlanta,Pensione privata con camera da letto matrimoniale grande e moderna,1 letto matrimoniale grande,01–06 ott,"4,9 (82)",147 € 
Casa ⋅ Atlanta,Penthouse Palace ATL,1 letto,08–13 ott,"4,88 (8)",263 € 
Stanza a Atlanta,Soggiorna con Anderson,Comodo Oasis - Affitto a breve/lungo termine,14–19 ott,"4,8 (20)",64 € 
Loft ⋅ Atlanta,Monolocale con parcheggio+ posizione migliore - 14,Host professionista,01–08 ott,"3,33 (3)",92 € 
Stanza a Duluth,Soggiorna con Vanny,La casa di Vanny,03–08 ott,"4,95 (43)",65 € 
Stanza a Atlanta,Soggiorna con Greg,Stanza da letto privata in Sandy Springs Executive Home,01–06 ott,"5,0 (15)",62 € 
Stanza a Atlanta,Soggiorna con Shante,Stanza carina che ti aspetta,03–08 ott,"4,84 (67)",50 € 
Stanza a Marietta,Soggiorna con Marivel,Camera da letto carina e accogliente a Cobb!,02–07 ott,Nuovo,58 € 
Bed and breakfast ⋅ Atlanta,Private Rm 10 min/Braves Stadium,1 letto,01–06 ott,Nuovo,84 € 
Stanza a Atlanta,Soggiorna con Jacob,Moderna suite privata in agriturismo,02–07 ott,"4,86 (21)",95 € 
Suite degli ospiti ⋅ Atlanta,1BD Intown Apt. Ottima posizione,Host privato,08–13 ott,"4,87 (1161)",118 € 
Stanza a Riverdale,Soggiorna con Lee,Casa lontano da casa (spazio condiviso),01–06 ott,"4,97 (197)",78 € 
Stanza a Lawrenceville,Soggiorna con Larry,"SkyRm#3: letti queen-size e letti singoli, finestra, 5 posti letto",03–08 ott,"4,83 (30)",52 € 
Suite degli ospiti ⋅ Atlanta,Appartamento seminterrato ad ingresso privato a Grant Park,Host professionista,09–14 ott,"4,88 (450)",139 € 
Stanza a Atlanta,Soggiorna con Akua,Letto privato con bagno privato nel centro di Atlanta,08–13 ott,"4,79 (39)",65 € 
Casa ⋅ Atlanta,Cozy 3BR Gem in Atlanta,Host professionista,02–07 ott,Nuovo,177 € 
Bed and breakfast ⋅ Atlanta,Private Room 10 min. From Braves Stadium!,1 letto,01–06 ott,Nuovo,84 € 
Casa ⋅ Atlanta,ATL Heaven 2 bed 2 bath,Host professionista,01–06 ott,Nuovo,218 € 
Appartamento ⋅ Atlanta,Splendido monolocale a Midtown con parcheggio gratuito,1 letto matrimoniale,15–20 ott,"4,77 (265)",158 € 
Stanza a Lawrenceville,Soggiorna con Tianjiao,Private Room w TV desk near Sugarloaf,02–07 ott,Nuovo,60 € 
Appartamento ⋅ Atlanta,Downtown Atlanta city view!,2 letti,22–27 ott,Nuovo,149 € 
Casa ⋅ Atlanta,Atlanta Art House* Fun Space* Huge Yard* Firepit,Host professionista,01–06 ott,Nuovo,307 € 
Appartamento ⋅ Atlanta,Lussuoso skyline di HighRise,3 letti,08–13 ott,Nuovo,335 € 
Stanza a Atlanta,Soggiorna con Noreen,"Last minute private room tonight, past midnite",01–06 ott,Nuovo,57 € 
Stanza a Atlanta,Soggiorna con Nikki,Sala d'angolo di Dunhaven,22–27 ott,"5,0 (39)",73 € 
Stanza a Peachtree Corners,Soggiorna con Daniel,"Tranquillo, pulito e accogliente in Norcross #1",01–06 ott,"4,95 (56)",69 € 
Appartamento ⋅ Atlanta,"Posto auto gratuito, vicino a Mercedes-Benz, Buckhead Lenox 3",2 letti,01–06 ott,"4,78 (101)",123 € 
Casa ⋅ Atlanta,Esperienza audace e accogliente ad Atlanta,4 letti,01–06 ott,"5,0 (5)",220 € 
Stanza a Duluth,Soggiorna con Luz,Elegante suite privata a Duluth,01–06 ott,"4,9 (68)",92 € 
Appartamento ⋅ Atlanta,The Cozy Townhome: 10 minutes from ATL Airport,3 letti,01–06 ott,Nuovo,230 € 
Casa sull'albero ⋅ East Point,The ATL Treehouse con vasca idromassaggio/spazio riscaldato,Host professionista,08–13 ott,"4,78 (435)",280 € 
Appartamento ⋅ Marietta,INTERA SUITE PRIVATA 1BDRM vicino a DTWN ATL con PALESTRA,Host privato,01–06 ott,"4,87 (334)",92 € 
Stanza a Atlanta,Soggiorna con Chanel,Chic South Downtown Private Bedroom & Bathroom,13–18 nov,Nuovo,56 € 
Casa sull'albero ⋅ Atlanta,Casa sull'albero di alpaca nella foresta di bambù,Host privato,25–30 nov,"4,96 (1000)",451 € 
Stanza a Atlanta,Soggiorna con Allison,vicino alla camera da letto dell'aeroporto #1,10–15 ott,"4,87 (469)",68 € 
Suite degli ospiti ⋅ Decatur,"Vagabonds, Eddie 's Attic, Downtown Decatur",Host professionista,29 ott – 03 nov,"4,93 (126)",111 € 
Alloggio (Atlanta),Camera privata con 2 letti matrimoniali in appartamento Lof su Beltline,2 letti a 2 piazze,06–11 ott,"4,33 (98)",77 € 
Casa ⋅ Atlanta,Splendida casa di lusso moderna ad Atlanta,Host professionista,01–06 ott,"4,89 (65)",428 € 
Appartamento ⋅ Atlanta,Comfort cosmopolita: nel cuore di Atlanta,Host professionista,09–14 ott,"4,89 (101)",151 € 
Appartamento ⋅ Atlanta,Accogliente giardino pianeggiante Piedmont Park Charmer,Host professionista,01–08 ott,no rating,113 € 
Suite degli ospiti ⋅ Atlanta,Monolocale 600 SF con ingresso indipendente.,1 letto matrimoniale grande,08–13 ott,"5,0 (5)",105 € 
Alloggio (Atlanta),Stanza pittoresca in un quartiere tranquillo,Host privato,01–06 ott,"4,06 (31)",50 € 
Stanza a Atlanta,Soggiorna con Hope,Cozy 1 Bedroom + Free Parking @ East ATL,01–06 ott,Nuovo,79 € 
Stanza a Atlanta,Soggiorna con Amrit,Accogliente 1BR in una casa di Atlanta in posizione centrale,01–06 ott,"4,82 (104)",84 € 
Stanza a East Point,Soggiorna con Kadeem,I tuoi prati ad Atlanta ❤️ | Spazio per uffici,15–20 ott,"4,56 (79)",57 € 
Minicase ⋅ Atlanta,Ti diamo il benvenuto al Tiny Mansion di Ormewood Park!,2 letti,22–27 ott,"4,96 (175)",165 € 
Appartamento ⋅ Atlanta,Skyline view to vibe out.,Host privato,31 ott – 05 nov,Nuovo,129 € 
Stanza a Peachtree Corners,Soggiorna con Esther,Accogliente 1 camera da letto con bagno privato,03–08 ott,"4,85 (198)",56 € 
Alloggio (Atlanta),"Butterfly Motel 3, senza coppie",Host privato,04–09 ott,no rating,50 € 
Appartamento ⋅ Atlanta,Grand Buckhead Apartment,Host privato,01–06 ott,"4,78 (9)",237 € 
Stanza a Dunwoody,Soggiorna con Biubwa,Dunwoody,01–06 ott,"4,87 (55)",92 € 
Casa ⋅ Atlanta,A pochi minuti dal Mercedes Stadium/Downtown ATL + 4k TV,Host professionista,01–06 ott,"4,28 (32)",107 € 
Casa ⋅ Atlanta,Ridente 4 camere da letto nel centro di Atlanta,5 letti,01–06 ott,"4,54 (112)",216 € 
Alloggio (Atlanta),Atl monthly extended stay,Host privato,07–12 ott,Nuovo,48 € 
Alloggio (Atlanta),Living the Beltline Dream,Host privato,01–06 ott,"4,92 (224)",104 € 
Stanza a Atlanta,Soggiorna con Isaac,Camera privata rilassante vicino all'aeroporto,09–14 ott,"4,81 (52)",66 € 
Alloggio (Atlanta),Oakland Estates,3 letti,01–06 ott,Nuovo,89 € 
Casa sull'albero ⋅ Atlanta,Casa sull'albero di lusso/rifugio benessere ad Atlanta,Host professionista,15–20 ott,"4,94 (72)",269 € 
Stanza a Hapeville,Soggiorna con Bradley,Incantevole • Vicino all'aeroporto e al centro • Tranquillo,08–13 ott,"4,74 (77)",60 € 
Appartamento ⋅ Atlanta,Downtown Studio Walk to Mercedes Stadium,Host privato,03–08 dic,"4,82 (57)",117 € 
Pensione ⋅ Atlanta,Smalahouse – 1bd/1ba tiny getaway in Grant Park,1 letto,08–13 ott,Nuovo,175 € 
Stanza a Atlanta,Soggiorna con Danielle,1 Mile Mercedes Stadium-Room C/Bagno Privato,08–13 ott,"4,72 (166)",68 € 
Casa ⋅ Atlanta,Cozy Cottage on The Beltline,3 letti,08–13 ott,Nuovo,147 € 
Stanza a East Point,Soggiorna con Adeyinka,Vita moderna di metà secolo,22–27 ott,"4,95 (21)",68 € 
Stanza a Smyrna,Soggiorna con Will,Camera accogliente in affitto a Smirne,01–06 ott,Nuovo,82 € 
Stanza a Smyrna,Soggiorna con Clark And Virginia,Posizione per la gestione della casa | Camera da letto privata,07–12 ott,"4,9 (483)",85 € 
Stanza a College Park,Soggiorna con Colette,Stanza privata sicura e tranquilla a 5 minuti dall'aeroporto,01–06 ott,"5,0 (15)",59 € 
Stanza a Atlanta,Soggiorna con Haman,Modern City Retreat,01–06 ott,"5,0 (3)",85 € 
Appartamento ⋅ Fairburn,Incantevole appartamento tranquillo con ampio patio e giardino,3 letti,14–19 ott,"4,67 (151)",116 € 
Appartamento ⋅ Atlanta,Cozy Apartment in Atlanta,1 letto,09–14 ott,Nuovo,115 € 
Stanza a College Park,Soggiorna con Sinclair,Accogliente atmosfera da famiglia,01–06 ott,"5,0 (6)",60 € 
Appartamento ⋅ Atlanta,"Virginia Highlands Escape! ""Tiny House""",Host professionista,02–07 ott,"4,38 (330)",91 € 
Casa ⋅ Atlanta,Historic Bungalow in Atlanta,3 letti,17–22 ott,Nuovo,172 € 
Casa a schiera ⋅ Atlanta,Peachy Royal Charm <2 Mi to ATLs Top Attractions,Host privato,01–06 ott,"4,88 (104)",112 € 
Alloggio (Atlanta),Camera privata con letto matrimoniale in soppalco su Beltline,1 letto a 2 piazze,09–14 ott,"4,44 (61)",75 € 
Stanza a Conley,Soggiorna con Kadeem,Sky Suite in ATL <3| Spazio ufficio + ping pong,02–07 ott,"4,3 (30)",55 € 
Casa ⋅ Atlanta,Atlanta Townhome Prime location,Host privato,01–06 ott,"4,86 (7)",391 € 
Stanza a Atlanta,Soggiorna con Beau,South Beltline money saver!,02–07 ott,"4,67 (12)",66 € 
